{
  "accession": "PXD000001",
  "file_count": 8,
  "files": [
    "files/pride/PXD000/PXD000001/5bda360133398f66021c8889e01dce921cb51300c7269e1f2b0f20368ab20af6.json",
    "files/pride/PXD000/PXD000001/ca2e3dea18950a328b7dc8303911961267a2c19058e67bfe49ab0d6784c3f62b.json",
    "files/pride/PXD000/PXD000001/8ce43227bda837e3cad6c4fa1b11c4094291c48d76ca469c66e0a4e1efebd7e7.json",
    "files/pride/PXD000/PXD000001/34476b308bb9dab10edab047891e2ef5ded65f458ba5c24022cfab3e1f757e90.json",
    "files/pride/PXD000/PXD000001/ffdea08e7981243dbf92b1cc6076edc8f481ba3e6db0d1e0ad641c8faa544b90.json",
    "files/pride/PXD000/PXD000001/8e9f031d8e56f5026860a1b116cbb8769787993c35f72b1d449254963c787b65.json",
    "files/pride/PXD000/PXD000001/146448a5a94636a2564a48082859cefac47c5e490fdc97b092a45c49c0a183ed.json",
    "files/pride/PXD000/PXD000001/4b46ae91064697f1c8df768df676ffaf7c6f0dad4f29523003be62fa09e7826c.json"
  ],
  "schema_version": 1,
  "source": "PRIDE",
  "source_retrieved_at_unix_seconds": 1781873453,
  "total_size_bytes": 514278049
}
